{
  "$schema": "https://json-schema.org/draft/2020-12/schema",
  "title": "Groundwork config",
  "type": "object",
  "required": [
    "approvalMode",
    "tokenBudget",
    "commands"
  ],
  "additionalProperties": false,
  "$defs": {
    "modelHint": {
      "oneOf": [
        { "type": "string" },
        { "type": "object", "additionalProperties": { "type": "string" } }
      ]
    }
  },
  "properties": {
    "$schema": {
      "type": "string"
    },
    "version": {
      "description": "The Groundwork version that installed or last upgraded this project's .groundwork/ files. Written by `groundwork init` and `groundwork upgrade`; `groundwork doctor` compares it with the CLI.",
      "type": "string"
    },
    "setup": {
      "description": "Whether gw-setup has run for this project. init writes pending; gw-setup sets done. /gw runs setup until it's done.",
      "enum": [
        "pending",
        "done"
      ]
    },
    "approvalMode": {
      "description": "per-card: the human approves every card before it is committed. per-phase: cards commit after review passes, and the human approves the phase as a whole. at-end: the runner builds every card straight through (committing each as a checkpoint), one review covers them all, and the human approves once at the end. After setup, only the human changes this (`npx groundwork-ai mode`).",
      "enum": [
        "per-card",
        "per-phase",
        "at-end"
      ]
    },
    "autoCommit": {
      "description": "Whether the runner commits each card when the workflow allows (default). false: it never commits; it tells the human what to commit instead.",
      "type": "boolean",
      "default": true
    },
    "integration": {
      "description": "local: card commits are gated by the local approval rules. pr: local task-branch commits are checkpoints; pull-request review and required checks govern integration. In pr mode the local commit gate does not demand a human approval line, and check does not require one for done cards.",
      "enum": ["local", "pr"],
      "default": "local"
    },
    "experience": {
      "description": "How much the agent explains. new: one sentence per step, How to check at every approval stop, a labeled recommendation for stack choices. experienced: terse, a short approval summary, options only unless asked. Read fresh each time, so it can change mid-project.",
      "enum": [
        "new",
        "experienced"
      ],
      "default": "new"
    },
    "tokenBudget": {
      "description": "Maximum estimated tokens for files loaded in every session (AGENTS.md plus always-on adapter files). Checked by `groundwork doctor`.",
      "type": "integer",
      "minimum": 500
    },
    "guards": {
      "description": "Guards to run before shell commands and file writes, by file name in .groundwork/guards/ (without .mjs). Empty means none run.",
      "type": "array",
      "items": {
        "type": "string"
      },
      "uniqueItems": true
    },
    "enforce": {
      "description": "Built-in checks that run before every shell command and file write, whatever `guards` lists. commitGate: a commit naming a card needs that card done and passing `groundwork check` (and, where the tool records the human's messages, a human message since the last commit in per-card mode). protectHarness: the agent can't weaken Groundwork's own setup (guards, hooks, this setting, approvalMode). Both default to true; only the human can turn them off, by editing this file.",
      "type": "object",
      "additionalProperties": false,
      "properties": {
        "commitGate": { "type": "boolean", "default": true },
        "protectHarness": { "type": "boolean", "default": true }
      }
    },
    "models": {
      "description": "Optional model per role, used only by adapters (the core ignores it). A value is one model name for every tool, or an object with one name per adapter (keyed by the adapter's name, as in `groundwork adapter add`), since each tool names models its own way. Leave a role out to use the tool's default.",
      "type": "object",
      "additionalProperties": false,
      "properties": {
        "planner": { "$ref": "#/$defs/modelHint" },
        "tester": { "$ref": "#/$defs/modelHint" },
        "implementer": { "$ref": "#/$defs/modelHint" },
        "reviewer": { "$ref": "#/$defs/modelHint" }
      }
    },
    "commitFormat": {
      "description": "The first line of each card's commit. {id} is the card ID and {title} its title, e.g. \"feat: {title} ({id})\". Quick changes use \"quick\" as the ID. Default: \"[{id}] {title}\".",
      "type": "string",
      "default": "[{id}] {title}"
    },
    "commands": {
      "description": "Shell commands the agents run. Leave a command empty if the project doesn't have it.",
      "type": "object",
      "additionalProperties": false,
      "properties": {
        "install": {
          "type": "string"
        },
        "test": {
          "type": "string"
        },
        "lint": {
          "type": "string"
        },
        "build": {
          "type": "string"
        },
        "run": {
          "description": "How to start the app so a person or an agent can use it, e.g. a local server. Roles use it to check a card in the running app; stop summaries use it for How to check.",
          "type": "string"
        }
      }
    }
  }
}
