{
  "$schema": "./config.schema.json",
  "setup": "pending",
  "approvalMode": "per-card",
  "autoCommit": true,
  "integration": "local",
  "experience": "new",
  "tokenBudget": 2000,
  "guards": ["no-ai-trailers"],
  "enforce": { "commitGate": true, "protectHarness": true },
  "commitFormat": "[{id}] {title}",
  "commands": {
    "install": "",
    "test": "",
    "lint": "",
    "build": "",
    "run": ""
  }
}
